{"aggregate_sha256":"334bbae68b531c30dd6b6fb2fb46d828a4f2efdf0d2ca5d906bcd5d21b3344d6","algorithm":"sha256-source-snapshot-v1","archive":{"format":"ustar-v1","sha256":"25b9f7597f90c74e9a401b1564b87d732298f577c959433ff433d5b2ded525c0","size":1208320},"exclude":["**/__pycache__/**","**/*.pyc"],"files":[{"mode":"0644","path":"AGENTS.md","sha256":"fef45b15c6e0721ad1afa9335900a68e2c6bdd055ed373c7dd86413fdcf925b8","size":5689},{"mode":"0644","path":"README.md","sha256":"6c4cdc0996947f48f7c8bcdba60e244a2f8e3e6aebde5ff58f5dba87f4cb7dc8","size":21729},{"mode":"0644","path":"SKILL.md","sha256":"ea626539317d5776445ca86a8957aa98fe7a6b684a6df5bbdc238dd89b4f1836","size":59489},{"mode":"0644","path":"examples/example_child_loop_tree/INDEX.yaml","sha256":"6119697f02cb0b50b163207f5e85ef8acc87251e4af353dc91acbc8e42104b66","size":277},{"mode":"0644","path":"examples/example_child_loop_tree/L001-example-delivery/_loops/INDEX.yaml","sha256":"dbac86c74edea457ed3ddfadd4659764b7101526d5f444ed29de57f85f6806f4","size":167},{"mode":"0644","path":"examples/example_child_loop_tree/L001-example-delivery/_loops/L001.01-fix-effectiveness-bug/checkpoint.yaml","sha256":"bc7fcf573e4e0c6aa587134b0951c780731f9a7294dfb65b8eb1ab594788e7d7","size":1664},{"mode":"0644","path":"examples/example_child_loop_tree/L001-example-delivery/_loops/L001.01-fix-effectiveness-bug/closeout.md","sha256":"a67c95143b652c73dad27717523b81efef4b311db9b7c7bb10fd9edcbbbede1f","size":1591},{"mode":"0644","path":"examples/example_child_loop_tree/L001-example-delivery/_loops/L001.01-fix-effectiveness-bug/event_log.jsonl","sha256":"14fc1848abfe1be6233c8bff5ebb33c701413552eac24a37075ca28e630aed8b","size":463},{"mode":"0644","path":"examples/example_child_loop_tree/L001-example-delivery/_loops/L001.01-fix-effectiveness-bug/evidence.ledger.yaml","sha256":"4af4dc1e08d7e175ab7fcc13ec3dca6f211620dcf605462dfdd0dc0d4bb8b5f8","size":415},{"mode":"0644","path":"examples/example_child_loop_tree/L001-example-delivery/_loops/L001.01-fix-effectiveness-bug/evidence/reproduce.txt","sha256":"8e4a865930c677d6510a1406015d92e1f8c5914ebdfbd7b39a95f335fd9e9734","size":173},{"mode":"0644","path":"examples/example_child_loop_tree/L001-example-delivery/_loops/L001.01-fix-effectiveness-bug/loop.meta.yaml","sha256":"4a279108c1f16aa4299ec3273eba6a82c10abda04b9d6d9f00ab11e00e177428","size":1650},{"mode":"0644","path":"examples/example_child_loop_tree/L001-example-delivery/_loops/L001.01-fix-effectiveness-bug/loop.plan.yaml","sha256":"fe6a827dc627c29fcba16e05ed84d4d35b647b8d9989570a3bd419248f59380c","size":3993},{"mode":"0644","path":"examples/example_child_loop_tree/L001-example-delivery/checkpoint.yaml","sha256":"2949aca247befebfe2127245c36a82100798b03cf14aa4a7140db327287be41e","size":1168},{"mode":"0644","path":"examples/example_child_loop_tree/L001-example-delivery/closeout.md","sha256":"a7e95f3f008fc99e1ea2d0e767e5f65bd2c677846bc1fd72904096859369bd27","size":1437},{"mode":"0644","path":"examples/example_child_loop_tree/L001-example-delivery/event_log.jsonl","sha256":"233e6b4e15f755b62cbc2b73f8307837340067129f8762d1bd5b19901de1cf16","size":448},{"mode":"0644","path":"examples/example_child_loop_tree/L001-example-delivery/evidence.ledger.yaml","sha256":"e5371d1087e0ca156b992bbf8b1a3bde9541572ea389670809cd4fac498c6596","size":463},{"mode":"0644","path":"examples/example_child_loop_tree/L001-example-delivery/evidence/charter.md","sha256":"c212f17fff389ba39f9664513135e7fb92eb4422511feadd191b77251f470ef1","size":206},{"mode":"0644","path":"examples/example_child_loop_tree/L001-example-delivery/loop.meta.yaml","sha256":"5fd624c934585dd9698c3944cc5627abf73e56866c8686cee728aa01160c7941","size":885},{"mode":"0644","path":"examples/example_child_loop_tree/L001-example-delivery/loop.plan.yaml","sha256":"3e6cd2692e8dfbe0b6b9c2d358676ff0429150c14232bfbde2d7a9bbc524d09a","size":4389},{"mode":"0644","path":"examples/example_child_loop_tree/README.md","sha256":"0e8c3ced45e19e7c5db9d1e0a3703a34b6b827bab084cb0643294c52821baf18","size":4655},{"mode":"0644","path":"examples/example_product_delivery/README.md","sha256":"3c783318c538ffb79cdc887c91d9ceacc7f50a5e1624a2a577623b70ab7ebd25","size":8052},{"mode":"0644","path":"examples/example_product_delivery/checkpoint.yaml","sha256":"0b85bf03e45acda2b042a2fa61bec8bb355619fcff3cab0484149caddef7b200","size":3462},{"mode":"0644","path":"examples/example_product_delivery/event_log.jsonl","sha256":"ab4fbd842139d289e4abd79e9c3646ce7da1473128204819b7cbccd8edd0f3b6","size":4231},{"mode":"0644","path":"examples/example_product_delivery/evidence.ledger.yaml","sha256":"1192c000c1a011023d78677f6399a0456deef8a34e4eb03d041a65b87da610cc","size":5831},{"mode":"0644","path":"examples/example_product_delivery/evidence/N0_charter.md","sha256":"c2a5554fc265cc79aa30742d66458c63c4292468aa068d6568b3c78949056019","size":198},{"mode":"0644","path":"examples/example_product_delivery/evidence/N1_discovery.md","sha256":"7d814e6ecd96fa5314b672a5433ad82163e8e3653b46b2926daa2431863d732f","size":182},{"mode":"0644","path":"examples/example_product_delivery/evidence/N2_risk_screen.md","sha256":"31eebf7ce77c73ad9003309181cb6ce9efbf1feceb1d190652d063f7fb264b1c","size":197},{"mode":"0644","path":"examples/example_product_delivery/evidence/N3_feasibility.txt","sha256":"e1ac80a714780100f3ce64bb14ff2f64573ff7c821bc96d55951d8cfb88d3b18","size":182},{"mode":"0644","path":"examples/example_product_delivery/evidence/N4_requirements_baseline.md","sha256":"328be416cacc653cd9f08a89d2d86ab06170c01fb8497fc0ebeb4271cd637a9b","size":191},{"mode":"0644","path":"examples/example_product_delivery/evidence/N5_architecture.md","sha256":"f830a6acd5daf684b4fe3e544807d9888b7f61dd380d9e14199ee30448e3c506","size":191},{"mode":"0644","path":"examples/example_product_delivery/evidence/N6_verification_plan.txt","sha256":"26b8558b18c7cdd8ff75896f14ee734bb90b0a1577c75f963d9645b8cfac824b","size":147},{"mode":"0644","path":"examples/example_product_delivery/evidence/N7_implementation.txt","sha256":"7ed9f7033fbc4678763a71c6bcd743d169793300e67a2db01296260a095327c3","size":130},{"mode":"0644","path":"examples/example_product_delivery/evidence/N8_review.md","sha256":"bd406d775d3e9a9c7f19298b1f0385d265f814b1b11b7ab274113604b4d81ea7","size":186},{"mode":"0644","path":"examples/example_product_delivery/loop.plan.yaml","sha256":"8e3bdcea0043b9afea64f8773902303e99b7f3cdf14a976f62435e0d8e91bc28","size":18869},{"mode":"0644","path":"examples/example_research_project/README.md","sha256":"e394b75d16f25ff3d22554a000560bb9c36076f6a04368bf4d62af05786664f9","size":7837},{"mode":"0644","path":"examples/example_research_project/artifacts/protocol/preregistration.md","sha256":"3494bc420bda76bcc36cc4c241121e7b19733834c0b09b275c1f8d2245627894","size":290},{"mode":"0644","path":"examples/example_research_project/checkpoint.yaml","sha256":"30d98aecbfab4e0e2e8778d44251b185153158eb703761079a0aae4346846674","size":3501},{"mode":"0644","path":"examples/example_research_project/event_log.jsonl","sha256":"92cea3a005d955e1ac418660b24b71010aa5f04a761ca917d6146916dd010fe2","size":2905},{"mode":"0644","path":"examples/example_research_project/evidence.ledger.yaml","sha256":"645fe3610048cb75704ddbaaa34bd1b5dc349690f6d7f9987536955aa0917135","size":4331},{"mode":"0644","path":"examples/example_research_project/evidence/N0_charter.md","sha256":"03c56fa1fa8b97481e2b1bd1ca797b840ba3e08dd842edf99c3d738198626983","size":206},{"mode":"0644","path":"examples/example_research_project/evidence/N1_scoping.md","sha256":"aec966e862f75cf42cb7478e42098dd523b027c098b0ca3c0e499f766b6ca16a","size":211},{"mode":"0644","path":"examples/example_research_project/evidence/N2_source_gathering.md","sha256":"55b1d3ef9b22368b3321c3e5727cdae53516f4f39b92e3d989ee1071bb1f4970","size":226},{"mode":"0644","path":"examples/example_research_project/evidence/N3_evidence_appraisal.md","sha256":"b06fa45aa674cc017aab4ed1f128342c53b771532635de9d09024c2a76a3a183","size":233},{"mode":"0644","path":"examples/example_research_project/evidence/N4_hypothesis_framing.md","sha256":"79bae0557d9ba491c0b57f770f89eff77aadc2e74c031016566252374d6b1163","size":184},{"mode":"0644","path":"examples/example_research_project/loop.plan.yaml","sha256":"54137ba9ba98304757c948bba6fb0a8846c58a464f0bcfd934db239e2820015c","size":18505},{"mode":"0644","path":"references/branching_parallelism.md","sha256":"f2541cf15c01d20924d620f22b639f5e691cf7b55ea8f354f5c0f6ddaf63a004","size":23163},{"mode":"0644","path":"references/command_system.md","sha256":"826e50cc17e20a8d9198580935a73cf89aafe636a827bb7279db12dd51768b98","size":4258},{"mode":"0644","path":"references/concepts.md","sha256":"68c87f93f0305d7b3a22f921e9dfb3386bad5610d43d8f2cdda5910aa824b22a","size":19392},{"mode":"0644","path":"references/evidence_gates.md","sha256":"2c9df6d12c0ebbb877d6fec59e0c5989c85abfccf0d6e84de9b9d6dba349752c","size":23244},{"mode":"0644","path":"references/exception_handling.md","sha256":"22b79193ac01611d19be32f0de6d8a4f042e310a138a54a75fd8919d0e263790","size":33973},{"mode":"0644","path":"references/execution_intelligence_policy.md","sha256":"bbfd9004674eb256238f057d6b1483b421114553e3acb634e0b1c000b9f8f57e","size":37331},{"mode":"0644","path":"references/human_approval.md","sha256":"0254c9c454489d35a068b8358c73a6dad74288bda4825d823f0425a81158d270","size":36213},{"mode":"0644","path":"references/layered_execution_chain.md","sha256":"7370cb50be994cf8197413c2aca0cad08a0f40e375153f6b79e39684da613175","size":23764},{"mode":"0644","path":"references/live_loop_semantics.md","sha256":"793add452b231d62f020bd082790e91cca7f5ea969db809ddfcc3423de323724","size":28227},{"mode":"0644","path":"references/loop_plan_spec.md","sha256":"f53c8148994220cc610811fa4fb7d214320645398a82fa7b30e4cb4a6508cdaa","size":25311},{"mode":"0644","path":"references/parallel_development_protocol.md","sha256":"c56c1e7d64c877203961a0bb6f9b23521bc1ef48e19f35a62fa6c54fe2be3970","size":20244},{"mode":"0644","path":"references/recovery_protocol.md","sha256":"8be62a3a4ae9073048ba5eb87b23e23dfa51f5d44b7e8f20eb